{
  "edition_id": "TW-BOOK-BOB-E01",
  "member_id": "TW-MEMBER-founder",
  "book_title": "The First Book of Bob",
  "edition_name": "Limited Truth-Seeker Edition",
  "edition_size": 100,
  "status": "reserved",
  "book_snapshot_id": null,
  "content_hash": null,
  "copies": [
    {
      "serial": 1,
      "registry_id": "TW-BOOK-BOB-E01-001/100",
      "status": "reserved",
      "issued_at": null,
      "recipient_member_id": "TW-MEMBER-founder",
      "replacement_for": null,
      "verification_path": "/trust-worthy/edition.php?id=TW-BOOK-BOB-E01&serial=1"
    }
  ],
  "created_at": "2026-08-22T00:00:00-05:00",
  "closed_at": null
}